{
  "title": "帮助菜单",
  "subtitle": "常用命令入口",
  "user": {
    "avatar_url": "https://q1.qlogo.cn/g?b=qq&nk=10001&s=100",
    "nickname": "星野",
    "title": "指令调度员",
    "id": "10001"
  },
  "group": {
    "name": "测试群组"
  },
  "permission": {
    "level": "admin"
  },
  "command_prefixes": ["*", "星铁", "/"],
  "prefix_chips": [
    { "text": "*", "dedicated": true },
    { "text": "星铁", "dedicated": true },
    { "text": "/", "dedicated": false }
  ],
  "groups": [
    {
      "title": "基础指令",
      "items": [
        {
          "name": "weather",
          "description": "查询天气",
          "trigger_type": "exact",
          "command_prefixes": ["*", "星铁", "/"],
          "primary_prefix": "*",
          "usage_args": "<城市> [天数]",
          "usage_parts": [
            { "kind": "required", "text": "城市" },
            { "kind": "optional", "text": "天数" }
          ],
          "permission": "everyone",
          "permission_label": "所有人可用"
        }
      ]
    },
    {
      "title": "游戏攻略",
      "items": [
        {
          "name": "已适配角色列表",
          "description": "查看当前已适配攻略图的全部角色",
          "trigger_type": "pattern",
          "command_prefixes": ["*", "星铁", "/"],
          "primary_prefix": "*",
          "usage": "角色列表",
          "usage_parts": [
            { "kind": "literal", "text": "角色列表" }
          ],
          "permission": "everyone",
          "permission_label": "所有人可用"
        },
        {
          "name": "角色攻略",
          "description": "按角色名或别名查询攻略图",
          "trigger_type": "pattern",
          "command_prefixes": ["*", "星铁", "/"],
          "primary_prefix": "*",
          "usage": "<角色名>攻略",
          "usage_parts": [
            { "kind": "required", "text": "角色名" },
            { "kind": "literal", "text": "攻略" }
          ],
          "permission": "everyone",
          "permission_label": "所有人可用"
        }
      ]
    }
  ]
}
